2	Ask people questions, find common interests, things they like to talk about/are proud of, something they're good at that you can learn from. When people get into a frame of mind of offering advice to you or helping you, they subconsciously start to like you more. This works really well I think if they're older than you and you seem humble and interested in learning and doing your best at your job, and that you've got their back and won't throw them under the bus to management. Try to avoid directly talking shit about co-workers, but let people rant to you about other co-workers if they're so inclined, it'll be an easy way to let them do the work of small talk and avoid making a potential enemy  for no reason by making a thing of it. It's an easy way to fake an amicable relationship with a co-worker you actually dislike if necessary. I think of it like being Sweden, you want to remain pretty neutral and still maintain relations with all parties to get business done smoothly without dealing with drama and bullshit. So let everyone talk shit to you about each other, be sort of non-committal in a way that vaguely makes them assume you think the same thing and have the mountain passes wired to blow. Focus on the few things you can find to like or have in common with someone, and you can manage to tolerate even some of the most annoying co-workers I've found. It's worth getting along with coworkers and being friendly so they have your back. It's nice when people are disinclined to throw you under the bus and if you ever fuck up they won't jump on you over it. You have to interact at least a little with these people one way or the other, so it's worth a small amount of effort to at least try and make it more enjoyable or tolerable.  Best case you can enjoy the small talk with them, or get past the point of small talk .
2	If it's your job to tell them when they are doing their job wrong, fuck it. You don't have to be friendly to work with them. Let them talk behind your back all they want. I don't see anywhere that you are needing friends so... I work in a call center with about 400 other people. I can count on 2 fingers the number of people I speak to on a daily basis and that is only because they sit with me at lunch. I have found that the less people know about you, the less they can say about you. And even those 2 people don't know dick about me. My philosophy is  "you don't have to like me but you will respect me"\n\nEdit- i am the elusive ISTP female. Sorry for formatting. Mobile. 
2	It sounds like there are some immature people at this work place. Not everyone needs to be a chatter box...
2	That sucks....and something I've struggled with. I've never really felt like a part of the team, even though I can get along with anyone. I'm just not buddy buddy with most, I keep to myself. Practicing small talk helps, but I'd say to find 1 or 2 people that you seem to have something in common with and try to get to know them better. And then you can branch out from there. 
3	If it's your job to get them to do their job correctly I don't see why it matters if they like you, what they know about you, or what they say behind your back. Screw 'em. Do your job well and go home.
38	Annoying an ISTP	Is it just me, but when a person purposely tries to piss me off (e.g. Like ppl looking at me with this fucked up look and then cutting the cake in the shitiest way possible) it doesn't work. It just meh, like okay idc, you except a reaction out of me and you aren't going to get it. \n\nBut when they do it unconsciously I suddenly become a pissed off 40 yr old Italian man.\nE.g. pointing at the thing with palm up "eh wtf, why u gotta do it like that, just do it like this (shows them how)" \n
36	being genuinely annoyed when witnessing inefficiency vs not being phased when someone is intentionally trying to piss you off
13	I'm perhaps one of the most patient people on Earth when it comes to dealing with people.  Inanimate objects on the other hand, will feel my wrath very quickly should they not comply with my wishes.
6	I don't get pissed off by people usually, I get pissed off over things that I can't fix but have to deal with.
5	Well I did read that in an Italian voice, so you must be right.
1	are you me?\n\nThis is exactly how I am. Like, I'm so contrarian that if someone is trying to get a rise out of me, I won't let them. But if someone is obtuse, it drives me nuts.
1	Ha ha, yes
1	Yeah I can easily spot the asshole and that just rolls right off but I am totally the Jimmy Fallon IT guy character from SNL... MOVE.
0	Yeah most people walk around with no idea of their surroundings. It pisses me off a lot. These people are so lucky that society exists because I think they would die in a dangerous situation where they had to pay attention. There's a lot of pickpockets around my school and I honestly am fine with them picking these unobservant people's pockets. If they don't want their pockets picked they need to get a clue
6	ISTP professional coders: which aspect do you prefer to work in?	The frontend UI/UX, tweaking layouts and colour schemes to produce functional and aesthetic interfaces?\n\nThe backend cogs, gears, and databases?\n\nTesting and fixing, hunting down bugs to work the cause of failure?\n\nReverse engineering legacy code?
3	\#5, taking a problem and creating a novel algorithm to solve it. But I usually have to deal with #2-#4.
2	2 and 4 are more to my strengths. \n\nI'm not good at creating aesthetics. I can tweak and improve aesthetics, but if I were to do it from scratch, it would look like something that begrudgingly goes on a fridge. I am good with user experience/application flow though.
2	I'm most interested in troubleshooting the cause of a failure. I'm not a "coder" by trade, but I do something similar all day most days and it keeps me interested.\n\nI also have an interest in properly normalizing a database and efficient code and whatnot, but also those things are often at odds with: "I could spend 3 days trying to make the most perfect thing, or I could spend 20 minutes, get it working "good enough" and spend those other days on something that matters more". The latter usually wins because interest in efficiency also encompasses "how much can I get done with my limited amount of time".
1	I'm a senior in highschool but visual stuff interests me the most
7	Any speed readers?	Right now I’m learning to speed read. Many think speed reading is “skimming” but actually it involves 100% comprehension. There are some readers who can read 400 pg books in an hour or less. I feel that this skill would be the most beneficial for anyone. Do you speed read?
9	no. i can speed read and i do for things i don't care about, but if i'm reading a book it takes me like two minutes to read a page
2	I can do less than 30 seconds per page, and I’ve read over a thousand books 
1	I am not diagnosed, but i think im dyslexic. I do skim a lot. I really wish I could speed read.
1	Maybe. How large are those pages, and the text? I can read approx. 85 pages of A4 in double-spaced size 12 font in an hour. I do agree though, speed reading is very beneficial. 
1	I don't think that would be the most beneficial skill for anyone. It may be beneficial for your ego. "Oh, look at me i finished one 300-page book in one hour." And so what? \n\nSense of accomplishment that will soon be filled with void because what's the point of knowing everything but you can't possibly applied them in your life? It will fill you with guilty feeling. Sometimes, ignorance is a bliss. \n\nThe most important thing is to choose the most relevant book for your life and one you can immediately apply. Take the time and enjoy the read.
1	Yes, I speed read.  But just got to this point recently after reading a shit ton of books, and when I say alot I mean ALOT.  I've read heaps of text books, novels, autobiographies, art history, you name it.\n\nThe trick came to me when I started trusting myself to go through the page and hone in on key words and letting the unimportant words fall.\n\nA 200 page informative book can be demolished in an hour.\n\nThe cool part is this:  I retain concepts way better with speed reading because I have the liberty to slow down at the most important concepts and speed up with fluff.
1	I used to read an entire page in a few seconds if I didn't follow the lines. \n\nAs an adult, I can skim quickly and that's basically it.\n\n&#x200B;
9	hello, how is your sex drive?	also... are you kinky? or do you like vanilla?\n\nor maybe strawberry.. 
13	High.\n\nI'm pretty kinky. I'm into intensity, would be a good way to describe it. \n\nI don't have any fetishes though, just a long list of things that turn me on. \n\nI'm mostly into pretty vanilla things like bdsm, cnc, and rough sex. \n\nThe most depraved thing I'm into is cuddling
10	Single is how I would describe it
3	Insatiable, and [varied](https://imgur.com/HLghB8y).
3	pretty low, but that's partially due to stimulant abuse. i don't really have any interesting fetishes
3	Awful.  But I am on medication that lowers libido. 
2	Medium to pretty high I guess? Depending on mood and if I'm single or not 
2	Sky high.\n\nAlso dungeons.\n\nEnough said.
1	High
1	Pretty high. Depends what you mean by kiny I like rough sex but not out of pocket kinks..
1	Yes
0	What , why
9	how do you guys appear or act in a setting where you are comfortable? how about when you are uncomfortable?	I'm getting real interested in the ISTP's.
25	Comfortable: quiet with occassional funny/witty observation humor/topic. Might get deep without warning.\n\nUncomfortable: quiet with weird fidgetty moves that signals "i want to get the fuck outta here"\n\n
3	Comfortable- relaxed and pretty in the moment, focused on what I'm doing or who I'm with and not much else.\n\nUncomfortable- silently freaking out and over-analysing things, which people definitely pick up on. 
2	Well depending on whether I'm uncomfortable because of fear or disgust I leave the situation or maybe figure out why I'm uncomfortable and fix it instead if possible. Sometimes you need to get out of your comfort zone though and push through with courage.
2	Uncomfortable - quiet, serious, and invisible (as much as possible), looking for exit, barely any speaking.. Possibly none at all and just nods and awkward/polite smiles. \n\nComfortable - can be loud, "extroverted", laugh alot, crack jokes, sarcastic, etc. 
2	Sit there like a badass
1	More comfortable = more talking/more engaged. The opposite would be in the corner watching and not interacting, or if I can't wallflower, simple yes/no responses.
1	When I’m comfortable, razor wit, salty jokes, extroverted-like\nUncomfortable- silent, invisible for the most part
1	Uncomfortable- resting bitch face on point. Closed off body language. Speak when spoken to.\n\nComfortable- resting bitch face on point with periods of slight smiles. Open posture. Cracking jokes. I am funny AF when I wanna be. 
1	Comfortable - Head in hand on desk, or using a chair's backrest, relaxed.\n\n&#x200B;\n\nUncomfortable - Furrowed brow, good posture, limbs drawn close to body.
16	ENFJ (Male) trying to figure out my ISTP crush (Female)	Met this girl in my class back in July and had a crush on her ever since. We hung out a few times during the summer (just the two of us) and I noticed she was quiet, didn't say much and was not super open and most people would describe her as hard to get to know. I asked her friend at the time if she was looking for a relationship and she said no. After that, I started hanging out with her in groups. I noticed though that whenever I would ask her to do something, she would always say yes or have a legit excuse\n\nFast forward a couple months, I ask her out. She initially said yes but then texted me saying that she recently got out of a long term relationship but she still wanted to go as friends. We went ice skating/dinner/bar and had a great time. She was more open, wanted to get to know me more and overall I felt closer to her.\n\nWe continued to hang for a while and doing more couple like activities (Breakfast then library/nature trail, watching the lunar eclipse together on a blanket). Her texting habits got better, she even texted me first a couple of times which almost never happened. Eventually, she invited me to do stuff with her friends too and I thought things were good.\n\nA couple of weeks ago, my friends and I saw her on dating apps and which lead me to assume she was ready for something. Her profiles on there and very little pictures and no descriptions what so ever so I'm not sure how serious it was.\n\nSo i decided to ask her out via phone and she said that she's inclined to say yes but she does not want a relationship. When asked if it was me or her situation she stated that she enjoys spending time with me but does not want anything right now. Currently, I'm trying to calm my feelings before I can be friends with her again. When I mentioned to her the dating apps, she said that she was on there for a week when she was most over school but deleted the app.\n\nAs an ENFJ who is completely opposite to you guys, I just wanted to know if this is normal ISTP behavior and I'm still trying to gage a sense of what she is thinking. I'm not sure if she was being honest with me or just trying to spare my feelings by not flat out rejecting me. Is an ISTP super adamant about that kind of stuff?\n\nTL;DR\nENFJ guy likes ISTP girl. Hung out with her multiple times. Asked her out and she said inclined to say yes and does enjoy spending time with me but does not want a relationship.\n\nEDIT: Essentially, I misread her subtle increase in openness and availability as a clue she was interested in a relationship.
19	honestly with istp’s, take what we say at face value. we are known for being noncommittal so if she tells you she doesn’t really want to be in a relationship right now, it’s as simple as that. \n\npersonally i’ve been interested in many guys before and haven even gotten really close romantically to them, but i’ve never really looked for anything serious (making sure to make that clear from the get go as to not lead anyone on). \n\nif you’re genuinely interested in this girl, i suggest continuing to spend time with her and see if she warms up to the idea of a relationship, but don’t force anything as it would only be met with hostility. 
10	Hmm. So I've never exactly been in this situation but I'll say this. I was friends with an istj and I knew he liked me.. But I wasn't interested in a relationship with him at the time so I kept our friendship... Off and on. He was probably my closest friend but I just wouldnt always keep up the friendship because I knew he liked me and it didn't seem right or fair to essentially lead him on.  I didn't have absolutely no interest though. If I had absolutely no interest, I probably woulda cut him off permanently. Fast forward several years, and I'm now happily married to the guy. 
6	Shes probably not beating around the bush. \n\nAs a sidenote, I've known a few ENFJs and I've gotten along well with all of them but couldn't ever imagine dating them or spending extended periods of time with them. 
1	You should probably take what she says at face value, however, my best friend is an ISTP and she has a huge crush on one of her classmates, but she actually told him she would never date him (by accident; long story. In reality, she literally cries over not being with him when she’s alone. I don’t know if that behavior applies to all ISTPs, but that’s just an example I thought of.
1	This has been the thing with me and this ENFJ male I've known for almost 5 years. I'm very open with him to the point of actually entertaining a relationship with him. Heck we even recently talked about sex and what we preferred. He snapped out the last time and hated me for leading him on. He's frustrated for a long time, and I could understand. We didn't talk for almost 6 months. He went on a few dates, and I did as well. Those dates didn't work, and we're now talking again. WTF. He's very appealing, but my life is a mess and needs some personal hardwork.. I don't mind talking to him on this level. When my life gets better, I'd definitely take a move. He's been very patient all these years.
1	yeah this sounds about right. She probably is considering it because you approached her but because it's not something she was interested in to begin with she probably considers a relationship low priority and is focused on other things right now. ISTPs can be kind of hot or cold while they are juggling what their motivations are at the moment. I did the exact same thing with the dating apps before. I made the profile just to see what was there and to see if there was anyone on there I thought was worth considering a relationship. Not really digging it i deleted it after a week and decided i wasn't interested again. 
1	We're not hiding anything yet you have so much to uncover
1	Istp female here. She is being pretty point blank with you. Labels don't mean much to me. We are probably the only females in the world that don't give AF about that.  Can you continue to see her without needing to know about the next step? Just roll with it and have fun. One thing you can be certain of...if she doesn't want to see you, when will tell you. I doubt she would be dating multiple guys because who has the mental energy for that? Or the want to? \nGood luck. 
2	What are some real life examples contrasting INTP problem solving method vs ISTP problem solving?	Title
13	There are none. INTPs create problems.
5	Friendships with ISFJs?	My best friend since childhood is an ISTP and I’m an ISFJ. I’m just wondering if these types are known to get along and what your experience with ISFJs have been?
5	I generally really like them, I'm dating an isfj at the moment. Sweet people (most of the time)
3	My sister who raised me and is my best friend is and isfj. 
10	I hate these questions. Look, you've been friends since childhood? I'm gonna assume you get along. Doesn't matter what type they are.
2	One of my most favourite colleagues is an ISFJ. It's always easy to talk to her. She doesn't make silly jokes and she understands what I want to say even when I can't explain it that well. She is so well-organised and puts her 100% into her work. If you need to get something sorted, she's the best person for the job. She easily gets annoyed when her project is stuck because someone in our team isn't doing their job (which I like because no one else seems to care).\n\nShe's by far the only ISFJ I have ever met but she does give me a very positive impression of her type. I know that everyone is different but we're talking about ISFJ in general here.\n\nAlso I've read somewhere that ISTP is the type that supports ISFJ very well. I don't remember the details but theoretically we compliment each other. This colleague of mine is one of the very few people I intend to keep in touch after I leave this job (which is a huge thing for an ISTP. We tend to forget about people as soon as they go out the door). So, yeah, I think we get along nicely :) 
2	My cousin who's one of my best friends is an ISFJ. 
3	If introverted functions have a "final state" then how does its position really affect it at all?	If we talk about Ti as an equation function, then it should have some "final state." For example Te says : gravity on earth is 9.8 m/s. Ti says force of gravity=(mass of planet)/(volume of planet) or some other bullshit.\n\nEssentially, Ti can eventually reach THE true model for gravity that will be representative of every future Te measurement. Just like any theory eventually is correct though unverified. Once Ti hits that "one true theory" it has nowhere to go.\n\nIf that's true, then why would inferior Ti be any different than dominant Ti? Yes the dominant Ti might reach it first because they are primarily focused on understanding Ti models, but if the inferior Ti user learns the models from the Ti dominant, what makes them any different?\n\nSimilarly, how does your Ni in yourself compare to an inferior Ni if both have achieved the "end state"\n\nIs the inferior function in direct opposition to the dominant? I.e. tertiary can still serve the dominant supportively, but the inferior directly causes the user to not only be stressed but also to be slowed down in the use of their dominant?
7	What are you looking for exactly with your recent posts to ENTP, INTP, and here? What's an end result that will satisfy these posts?
2	I think you are over-complicating things too much. Go have a good read through [Psychological Types](http://psychclassics.yorku.ca/Jung/types.htm) and you'll realize that all Jung talks about is definitions of functions and how they are expressed through the two attitudes.  \nThe difference between introverted thinking and extraverted thinking is that introversion is an attitude focused on making judgments based on an internal standard (aka following your "rules"; an evolutionary adaptation of preserving the self) and extraversion is an attitude focused on making judgments based on an external standard (aka following "the rules"; an evolutionary adaptation of propagating yourself in the world). The Te user obeys the laws of society and the Ti user makes his own laws. And here we see the first problem with the ego - that of relying to heavily on one function. If you rely too much on Te you become someone that never thinks for themself and becomes a sheep to the rules even if they don't make any sense. If you rely too much on Ti then you become someone that often gets into trouble with the law and can't integrate into society because you don't understand that you have to follow rules. It is only through a process of individuation do we learn how to use the repressed functions and our psyche becomes balanced.\nSince they are in the same realm of thinking, you often find that Ti types use Te a lot and vice versa. This is something Carl Jung talked about and is why I believe the 5th and 6th functions are actually stronger than the 3rd and 4th.  \nIf you're talking about the tertiary function, keep in mind that it is repressed by the auxiliary function so it's not actually that strong. Ti represses Fe just as much as Fi. However, the Ti user never uses Fi because their internal judging is done with logic not feeling, so their feeling standard is rarely internal and only ever comes from the external world.  \nAnd then things are more complicated when you start talking about "loopers" and how your interpret Jung's explanation of the auxiliary function.
2	Life time is not infinite.
1	A mind with perfect knowledge would likely continue testing new information against the perfect knowledge to ensure it holds up, so the knowledge wouldn't change once it's perfect but the mind would still process information surrounding it\n\nHighly unlikely a single human mind could develop perfect knowledge in a lifetime\n\nBut as a hypothetical the perfect knowledge in one mind would obviously be the same as the perfect knowledge in another mind... because it is perfect...
51	Really don't know how to talk to most people	Like it seriously baffles me, how do people have conversations, long in-depth conversations about their bus route, or their trip to the doctor's office, or some other mundane thing? It's like, I have nothing to say, Idk how people do it.
45	I was like that once, but then i just don't anymore. Don't know how though, the skill just...clicked...\n\nI think its because I watch how people interact for so long that i subconsciously knows how to act now...observe, copy, and adjust kind of thing.\n\nDamn i sound like a sociopath trying to pass as a normal human...
14	Maybe it's not that you don't know how to talk to people. Those topics you listed down just isn't very interesting and some people like talking for the sake of talking. That's not us.  It's fine, you be you, let them be them. There's no need to force yourself to engage in conversations you think are boring.  \n\nTypical solution (if you consider your situation a problem or bothersome), you just have to find people you have common interests with and connect with and the conversation could possibly go on for hours. 
5	Practice. \n\nNot everyone gets proficient in all the socio-emotional skills growing up. \nNBD, you recognize a skill you lack proficiency in, congratulations on your self-awareness, seriously.\n\nNow you have the agency to either maintain your current skill level or take steps, no rush, to improve.\n\nThat said I dont know how people get up at 4am to run & I'm not interested in improving that skill at all. 
4	I doubt these are *in depth* conversations. \nI'd rather opt out of hearing mundane details of someone's life, and don't find interesting recounting mine. \nIt's ok. You'll tak with fewer people about something that is of interest to you. 
3	Do you feel bad because of that? Would you actually like to talk with random stranger about your bus route? Would that actually make you happier?  \nStay yourself, find meaningful connections with people that share your interests. Conversation will just start itself. If you wan't to learn a chit-chat, it's possible, but is this your goal at the end?   \n
3	[deleted]
3	Small talk is the worst thing in the world. Or being alone in a room with a crying person...
2	ask people questions about themselves. have hobbies, know interesting stuff to talk about, make jokes. conversations just kinda flow naturally. \n\ni used to feel similar to you, but the more i just got out and met tons of people, the easier it became and now it doesn't bother me.\n\n
2	Same way, fuck it. Talk about what you need to talk about, and dip
