7	Ugh. This stream of thought writing style isn’t conducive to understandable written communication.    \n  \nPlease use paragraphs at least when you have changed direction.  \n\nI have no idea what you are even asking.   I’m only replying because you called us “beep boops” and I found that entertaining.   \n\nStop being so self analytical and go with the flow.  
5	this is why you don't do a rail before making a text post. 
1	Shut up ENTP, I'll dropkick you and your bitch
6	Jet's MBTI - Cast Podcast	Hey Reddit, my name is jetplane48 (ESTP 7w8 sx/sp) and I am starting up a podcast in relation to MBTI. Fundamentally, the goal of the podcast is to educate the viewers of several Typology systems through a series of one-on-one's with others who are interested in the same topics. I have been conducting interviews for many years (MBTI related) and this is just an extension of that, however, I want to discuss topics that the audience wants me to cover. Naturally, I'll come up with my own material but I would love to explore topics that others have in mind. I am busy with school for the next few months but when I finish, the goal is to eventually be more consistent with these podcast uploads if this turns out to be popular enough. I'm very excited to get this started, and let's see some questions!\n\n&#x200B;\n\n[https://www.youtube.com/watch?v=HAR20eDTSOg](https://www.youtube.com/watch?v=HAR20eDTSOg)\n\n&#x200B;
1	This is really cool! Thanks for putting in the effort to help others understand themselves. I hope you receive the proper encouragement to continue! I haven't been able to get to a quiet, still place to give it a listen yet but I love the idea. 
15	ENFJ-ISTP Couple	I’m an ENFJ (F), dating an ISTP (M) of the same age. He’s my first boyfriend. As for him, he was previously in a 5 year relationship.\n\nWe connected on a dating app. He was my schoolmate, and I knew of him but was no acquainted. My BFF was his ex-classmate and the one who told me to like his profile and one thing led to another...\n\nIt took like two days of texting before we started to really connect with each other and catch feelings. (He says he already had positive feelings for me from the start, though) I generally take awhile to trust men, so it was really surprising to me how fast I fell into this. \n\nEventually, we made it official. Fast forward 5 months. It was great at the start. He’s never met someone like me, who’s really expressive, funny and direct. I’d never met someone like him, who didn’t play games and was just direct and honest. It helped that we both love working out and watching political satire.\n\nThings haven’t been great the last month. He was so busy with work that he had to keep cancelling on dates. I tried my best to be understanding, though I did tell him that I really wanted to see him. He started to become less expressive and consistent when texting. We finally met after 2 months of not seeing each other, and he didn’t even initiate any physical contact. \n\nI spoke to him about this. I also communicated that I felt neglected and alone in the relationship. I didn’t expect long conversations, but sometimes, he only drops me like 3 texts? He apologised for making me feel this way, but he said he had no idea I was struggling. He then said to discuss this at a later date.\n\nThen, it was 4 days of radio silence, until I initiated contact and asked to go on a date. He couldn’t because he was meeting his friends.\n\nContact resumed and just when I thought things were finally alright, last week, it was a full week of radio silence. He only called me after I dropped him a text telling him to do so, so I could ask him out. I’m planning to see him this week to talk about what just transpired.\n\nIs it time to call it quits?\n\nI’m so confused by his inconsistency - I have no idea whether his feelings have changed or he seriously thinks a relationship is supposed to function without engaging in any contact?\n\nI knew an ENFJ/ISTP relationship wouldn’t be easy, since we’re as different as night and day, but I hadn’t expected it to be this tough.\n\n
27	This is not an ENFJ/ISTP thing.  This is a guy breaking up with you thing.  He no longer wants to have a relationship with you, and, in fact, *is* no longer in a relationship with you.  He should just tell you, but at this point you should be getting the hint.\n\nI’m sorry to be so blunt, but it’s time for you to throw his number away and move on.  
7	[deleted]
7	> Is it time to call it quits?\n\nIt's up to you to decide how long you will allow to be treated this way. But it is actually a good question to raise directly to him.\n
6	Socionics says this is the perfect couple. If he suddenly starts changing his behavior, there's a problem. And I'm also baffled by the fact that you're still having to set up a date after 5 months. Sorry but I think you should just end it. Maybe he'll come to his senses then. But probably not. -ISFP 
3	Totally agree with tool-user about it not being an MB relationship thing, but wouldn't go as far to say it's over. My ENFJ SO has to drag my feelings out of me sometimes and whilst initially I'm reserved, because emotions aren't as important to me compared to trust and common interests, I always gain something positive from the experience. However in my earlier years I would quit and run pretty quick or, in my last case, bury my head in the sand and let it carry on for much longer just ignoring the issue. A lack of communication is usually the issue and if in honesty you aren't getting what you want from a relationship that should be a reason for you to break it off with him.
4	How old are you guys? He sounds like me at age 15 before I had any idea how to act in relationships.
3	This should be about your personal relational boundaries, and not up to him. I understand that it's your first relationship, but it's not the end of the world. \n\nLeave things as they are. Move on before you regret and lose respect to yourself.\n\n&#x200B;
3	Yeah this doesn't have anything to do with personality, it's just him being bored I think. Be direct and cut it off. This is a life lesson for you: When other people drag you along without reciprocating, don't simply cut off contact but be direct and tell them exactly why you're doing it, and draw the line. Ghosting while breaking up is just as bad as ghosting during the relationship.
1	[deleted]
1	If I don't talk to someone in a week I kindof forget they exist. It wouldn't necessarily mean I dislike them but it also means I'm not really thinking about them. Just my experience
1	> Is it time to call it quits? \n\nYes\n\n&#x200B;
0	Yeah, this isn't an ISTP thing. He just wants to dump you. None of the ISTPs I've been with pulled this on me, not yet anyway - had an ESTP do it though, such a motherfucker.\n\n&#x200B;\n\nIf it makes you feel better, he's actually your conflicting partner. You want an ISTJ.
28	I don’t know if this a Ti dom thing, a ISTP thing or just in general with people, but I’m wondering if it’s easier for you guys to work when your by your self and not being watched by cameras?	
28	Cameras don't bother me too much because it's just a fact of modern life. Having managers and supervisors around sucks it out of me though. My rationale: if they're watching, there's a reason. I want to figure the reason out as quickly as possible to help them get to the resolution so they can leave and let me do my thing. If it's an audit / observation type thing, that's great, but I prefer people just be upfront and say "I'm going to watch your work process for a little, go ahead and do your thing" rather than try to be sneaky or invisible whatever.
19	Yeah when someone's watching me preform something  when I'm usually not watched I will get thrown out of my "flow".
6	I hate people watching me work, but don't care about cameras.
6	If I know people watch me I get nervous and watched and it will not go right. I don't know why but I had this since I was little. I can work better without being watched. But I'm not sure if cameras will give the same effect. 
3	I work better if i'm being observed, or I start  using instagram, facebook, tinder, reddit...\n\nAnd being observed doesn't botter me, I actually like it
3	For me it’s not so much about being watched as it is about being interrupted. It seems like anytime you make eye contact with a manager they ask you to do something. It adds to my mental to do list and the effort of remembering more things makes it harder for me to get things done. 
3	I hate people watching me in general.
3	Yeah... I cant stand being watched when I'm trying to work on something... I usually have several iterations of attempts throughout my thinking process and would rather people not see the early attempts >. >
1	Yup
1	yea
13	What to do next?	Sorry for posting a relationship post (in case these types of questions are annoying to you guys) but I really like this guy and don’t want to mess it up. :)\n\nI am an ENFP, he’s an ISTP. We met about two weeks ago on a dating app and hit it off immediately. He’s hot, super sweet and easy to talk to. A few days after we met, I texted him inviting him to go to a hockey game with me, but we ended up staying in and chilling at his house, which was fine by me. I’m not the type of person who has sex with someone until I really feel comfortable with them and he was basically still a stranger to me at that point so we didn’t do it, but we fooled around a bit and I ended up staying the night. He made me feel so safe and comfortable and never pushed me too far even though I could tell he wanted it. \n\nAfter I left, he texted me every day little things like how was your day, hope you’re having a good day, etc. It took me aback a little bit since it wasn’t something I was used to, but I assumed he was just thinking about me a lot, and I was thinking about him a lot too, so it was fine. I went over to his house on v-day before heading out to dinner with friends and it was really nice. I could feel myself feeling more comfortable around him and enjoying myself more. He mentioned something in passing about having to focus harder on schoolwork and he also said he was really tired because he hadn’t gotten much sleep recently. After I left, he called me right when I got in my car and gave me directions all the way home because my gps wasn’t working. It’s things like that that make me smitten with him. :)\n\nBut I haven’t heard from him since. I think it’s fine, because he probably is just focusing on school but it does make me a little uneasy in case I did something wrong. I’m also self conscious that he may be no longer interested since I’m not having sex with him right away.\n\nI’m going to wait and see what happens, but I wanted to post here and see what you guys thought was going on and what I should do. It might help stop the what if loopings in my head that are going to confuse me and drive me to do something irrational. Feel free to ask for more details if you like! Thank you very much for reading. \n\nP.S. The first night, I had lost my hair tie and was kind of upset that I had to go out with my hair in a mess and I asked him for a rubber band but he said he usually just throws them away. When I went over the second night though, I saw that he had saved a rubber band on his wrist. :) maybe just a coincidence, but maybe not. Anyways, no more gushiness. ;)
17	Text him and ask how his day is or something. Don't just wait for him to initiate conversation, he may feel that if he's always initiating he is just annpoying you and you're not interested.  \nAnd the rubber band was not coincidental, it was for you
13	We are notorious for needing space and we sometimes don't think about how it affects others. It sounds like he likes you. Just shoot him a text (don't call or show up) and see if he wants to go do something soon. I have a feeling you're over thinking it. \n\n\nBTW my gf is also ENFP. We deal with things like this regularly where she thinks she did something wrong because I don't give her unprompted physical and emotional validation. I just don't think about it like that. 
4	You can't take his interest and his behaviour for granted. Texting you daily is his way of showing interest in you. But if he doesn't get anything back, he'll think that you're not that interested. \n\nIt's possible that he's not texting you now, because he's trying to gauge your interest in him. Your interest doesn't have to be expressed by texting. You can simply invite him to spend some time together doing whatever - watching something, taking a walk, studying together... any activity.\n\n&#x200B;
2	Hey, waffle. Here's how you keep communication with your ISTP.\n\n1. Do not expect your ISTP to initiate. Ever. You're the initiator type, so take charge! You can complain, but never get tired of doing it! We love it.\n2. Always ASK. Don't ASSUME. (This is how dumpster fire of communication begins between an ISTP and ENFP). Remember that we're worlds apart in terms of seeing things. \n3. Believe what he says. ISTPs mean what we say. If we say, "black", it means "black", not "dark grey". \n4. Give him alone time. 2 weeks is normal of not communicating with you. We aren't like you who tend to lose your mind and world for love. And want being always together, cuddling and exhausting all the feelings 'til you get bored.\n5. If you want sex, say it. You refrained not to and yet now you're wondering whether it's causing his detachment? That's all in your head. Stop that habit of unnecessary concern.\n6. You are not the center of his life. What we do is. Remember that always.\n7. Don't be like these stupid ENFPs who plague our lives. Search ENFP posts in this subreddit. You'll figure.\n8. Keep your emotions to your fellow squishy friends. We need only little. Even a smile can make our day. \n\n&#x200B;
0	That is *perfect*. This seems like a duality type in socionics. Your man is an SLI, you are an IEE, this is the best combination an SLI and an IEE can have when addressing cognitive functions, which may explain why you clicked so fast. This is definitely a relationship worth the extra effort. Just dont barrage him, the patience is part of the effort 
13	Help with feelings?	From what I’ve read on here, ISTPs are supposed to have minimal feelings. \nHowever, I feel that I am a very empathetic person, to the point where those short ig/fb/yt clips about sad things make me cry immediately. Pretty much any video with sad music or and lonely old person will make me cry within seconds. Even thinkjng about it made me cry. I will even do this in public.\n\nHowever, I don’t  have feelings about my own life/people around me. I’ve never been emotionally attached to anyone, and while I’ve made really close friends, and am grateful for my family, I feel like my feelings are more of loyalty than of love. Does anyone have friendships like those in anime or movies? \n\nSo, two questions:\n1. Are there any other istps who irrationally cry when they hear sad music or watch a sad video (even if it’s poorly made/not good)?\n\n2. Is what I feel for my friends and family loyalty or love? Does it matter? How do most people feel about their friends?\n\n19, female
31	ISTPs can have very meaningful, deep, emotional connections to things and people. I hate to break it to you, but I think you're normal.\n\nThe whole "ISTPs are robots" thing is a little exaggerated. It doesn't mean we don't have feelings. But at least in my case, it usually means "I share my thoughts regardless of the feelings of others because I value truth over feelings". That can lead to us being seen as cold or unfeeling, erroneously in my opinion.
7	i’ve been crying for 3-4 years. (25M)\n\nSure we don’t show emotions right out. My colleagues think I’m emotionless therefore I dont feel hurt from offensive shit or what not. They are so wrong but I can’t blame them.
7	Unfortunately this is normal and something you are stuck with as an ISTP. We arent emotionless robots, its more that our feelings are more deeply rooted in physical things. The homeless, neglected, abused, hell even old derelicts cars/trucks make me have pangs of empathy, remorse, and sadness. Its just something you have to learn to deal with.  
5	My husband is an ISTP and he suggests that you stop it.\n\nNow my contribution. When we were dating, I broke up with him for a brief time and he cried. He hasn't cried since, but clearly it's a thing that they do sometimes. My husband is very loyal to his family and friends. He just doesn't like most people. The ones he does though, he'd take a bullet for them, I have no doubt. As far as music and movies, he's capable of feelings but he doesn't emote them outwardly at all. He'll say something effects him but he remains stoic. But a lot of his family is like that and they're not all ISTPs.
3	Give me whiskey, play Bob Dylan's Most Of The Time, I'll be reduced to tears.
3	> 1. Are there any other istps who irrationally cry when they hear sad music or watch a sad video (even if it’s poorly made/not good)?\n\nMaybe the ISTP aspect of this is not so much the crying or not crying, but the fact that you label it as "irrational" and ask others if it's normal. :) I think feelings often seem sort of *alien* to us, both in ourselves and others. And many of us might not communicate them very skillfully. But that doesn't change the intensity, or "worth" of the feelings.\n\n> Is what I feel for my friends and family loyalty or love? Does it matter? How do most people feel about their friends?\n\nAren't these excellent questions? :)\nAgain, if you weren't an ISTP (or something close), you probably wouldn't question these things as much. People to whom feelings and relationships are "natural", probably don't _need_ to think about these things like you do. Maybe they take it for granted. Maybe the distinction between "true" and "fake" feelings, is less important for a natural feeler. Always seemed like a paradox to me, when "feelers" are able to express affection in a seemingly much more careless, irresponsible way, because they sort of own the domain. (Obviously this is a generalization and how it appears to us, no criticism intended towards any personality.)\n\nYou don't sound weird to me from your description.
3	I just got my period the morning after I posted this. Might explain why I was so existential 
3	**1.**\n\nNo, I don't. I once leaked a couple of tears in a cinema theater a few years ago because a woman was begging a doctor to take her daughter's rare medical case else she die, and I was stressed out at the time.\n\nAnd of course, my friend was watching me.\n\n&#x200B;\n\n**2.**\n\nISTPs can experience love; we're generally not sociopaths. Expressing it, however, can be difficult. At least for me.
2	> Are there any other istps who irrationally cry when they hear sad music or watch a sad video (even if it’s poorly made/not good)? \n\ni am susceptible to teary eyes when witnessing betrayals or reconciliations\n\n> Does anyone have friendships like those in anime or movies? \n\ni cant pinpoint the feeling of love but i value loyalty and the feeling of caring towards those close to you.\n\n&#x200B;
1	1. Yes, sometimes I do that because I think I recognized my feeling but I dont know how to express it, tears already collected around my eyes. It's like I'm sad/happy/angry, my brain lost the correct words and my body speaks for itself through crying?\n2. Yes, until today I still wondering what is like falling in love, like those depicted in books and movies. Is it like when I'm obsessed with a new hobby/project that I keep thinking about it? But human isn't a hobby or project. 
1	It's probably our body's reaction to us not thinking about our emotions so it comes out that way
1	You are growing up and you are female, probably it's hormones.
51	Married to ISTP.	Just a quick note to say I love ISTPs. I'm a female INTP and I married a male ISTP a few years ago. We have one of the most easy rapports I've ever had. When we met we were like magents. He is my best friend. I love that he is not easily offended, he is honest and straightforward. My head is always in the clouds but he grounds me. I think about the future, he thinks about the present. We love to make fun of each other and things that are stupid or illogical and we seriously love to argue.  Sometimes he will come home from a stressful day needing space and I like to jokingly ask whether it's a good time to talk about our feelings. Hahaha cracks me up every time. Anyways, with some obvious exceptions like Tom cruise, you guys are awesome. Don't ever change ;) 
13	Thanks! \n\n\nI never knew Tom Cruise was ISTP. We do have Harrison Ford though so it's not all bad. 
9	> Sometimes he will come home from a stressful day needing space and I like to jokingly ask whether it's a good time to talk about our feelings. Hahaha cracks me up every time. \n\nIt cracked me up too :D\n
9	Calm down with the Fe that's not allowed here
4	I'm a female INTP married to an ISTP.  I relate to much of this except he hates arguing and isn't so good at laughing at himself but we enjoy laughing at other people. We're jerks. It's fun.  \n\nYou seem to have better Fe than I do. 
2	ISFJ (31F) married to an ISTP (32M). I can't agree with you more. Being married to a logical, respectful introvert makes for a very peaceful life.     ISTPs hold a very special place in my heart!
2	ISTP bf too! Love that they are not easily offended! 
1	Which type are you?
1	I'm an INTP with an ISTP too and you described the dynamic to a "t". ISTP's are great
1	Im an ISTP and hope to find a understanding match like you someday. Being an ISTP isn't always so glamorous.
1	My INTP has been depressed for three months now. Unresponsive. We were magical together. Best dates ever. But he has ghosted me after two love letters. It's almost a month now. First time I am brokenhearted (because he's struggling and he doesn't want me to get near him).\n\nI love you, even when I can't say it or these things to other types. There's just something about INTPs that make me feel heard, respected and so childlike.\n\nSex is heavenly as well. It's perfect. Ugh. Fuck you, INTPs.
1	Thanks,  🍻See lads here's to adventure if they're for it.
1	I like Com Truise...\n\nnice sounds...
0	ISTP/ENFP Divorce	   \nlevel 1[Hotmessmamajama](https://www.reddit.com/user/Hotmessmamajama)1 point·[just now](https://www.reddit.com/r/istp/comments/9ylc0y/how_do_you_istps_handle_a_break_up/egnaxuw/)\n\nHelp me understand what is going on in my ISTP ex's mind. I tried hard to reconcile at first but now am trying to move on. Based on this story, should I try again or let it go. I do feel like he's been my best friend despite details below.(Sorry, I'm an ENFP. Sit back for the novel...)\n\nI am an ENFP who was done with my 18 year marriage to an ISTP (too little emotion, too much judgement, too little honesty about anything financial-unknown credit cards, lied about purchases, past jobs, etc. early in our relationship, yet really working on himself later in our relationship) and fantasizing about living in an apartment or condo on my own or with my son.\n\nThen we had our discussion where I told him I slept with someone 15 years ago (super shitty on my part and I had been a hypocrite about all of his honesty things). He said he wanted a divorce right away and moved into the spare room. So angry and rage filled. Emotional talks every night and then we had sex two nights later. Really nice sex that we hadn’t had in years.\n\nDue to my immaturity with conflict and recognizing my true feelings, when I got angry with him I’d withdraw emotionally and sexually. But now that all the emotions were out and all the truths were out, we became more physically attracted to each other (or I at least did to him, he’d been initiating sex for awhile and I rarely “bit”). So sleeping together a few times a week, living under the same roof, sharing a young son, figuring stuff out. Then he said he was moving in with his boss (10 years younger, two young boys, also going through divorce). Took me by surprise at how fast he was moving on yet still wanted connection and sex with me. Keep trying to stick to no sex but it’s been hard because damn, it’s been so good. And so confusing.\n\nFeel like I’m falling in love again. But he’s definitely moving on and still so angry about infidelity. And then his boss who he has a “special connection” with. What the hell people? Now it’s been almost three months since we had the talk where he wanted divorce. Still wants sex and “connection” with me but is texting boss all the time and moving in with her. I’m trying to be in it just for the sex (who knows how long it will be for me again?!) but it’s hard to separate emotions. I feel like I’m fucking myself over but have little self control. I suggested reconciliation about a month and a half in and he freaked out, “Do you think I forgot about what you did?” Oh, lord. What a reality TV show. Is this kind of thing normal? I’ve been together with him since I was 21 and for 21 years. Only had one boyfriend before him. A couple of times, he's tried to say "no sex" and couldn't stick to it. Is it all physical? Or the 21 year connection? Or is it something I should try to nurture?
9	Once an ISTP turns on his apathy, there's no changing it. There's nothing to read. You're a good fuck, and all the years you spent were already set on fire (without you knowing it).\n\nYou are ENFP. You struggle with Inferior Si (everything about the past and mistakes). We don't have Si. We don't give a fuck about our past. It's done.
