3	Hi there, I’m neither Te dom nor ISTP, but I *am* a pretty strong Te user who often has frustrating arguments with my ISTP spouse. Here are some things I’ve noticed about our conflicts:\n\n(1) I don’t give a shit about WHY something works. If it is a solution and it’s effective, then boom. I’m done. Moving on. It works. He wants to continue to entertain various possibilities or unlikely scenarios that might play out and prove to be an exception to the rule, which I find highly annoying. I used to even wonder if he was just looking for an excuse to argue or trying to be difficult. \n\n(2) He has a fuzzy, spatial logic that mostly serves to justify his inferior Fe. And he doesn’t seem to realize it. I’ve pointed it out and he thinks it doesn’t matter. So the rules of a logical debate do not apply. He will resort to straw man arguments, ad hominems, deflections, gas lighting.\n\n(3) he shuts out any incoming information that conflicts with his preconceived notions or, going back to my previous statement, goes against what he “feels” is right. He also entertains bat shit insane phenomena and superstition like chi and karma that cannot be scientifically proven.\n\n(4) he questions medical professionals, legal advisors, teachers, pretty much anyone in any field of expertise, almost as though it’s his duty. I got major problems questioning a doctor who went to school for twelve years and practiced for another fifteen, when it comes to chemical reactions and medications and anatomy and shit I know nothing about. Yet my husband is a contractor and feels *A-okay* antagonizing someone in any field of expertise, as though they have to convince him first, before they can be taken seriously.\n\nEtc.
2	You shouldn't have issues projecting your logic on mature Te users. It's only the immature who have too much pride to admit when they're lacking.\n\nMy two best friends are Te doms: ENTJ and ESTJ, and sure, they can have their moments where their pride gets in the way. But they'll usually accept input if the logic is better than theirs.
2	Just remember that Ti doms share a good deal of function with Te doms. The difference is that Te doms follow "the rules" and Ti doms make their own rules.
1	> however it feels needed that I make this post\n\nnah
1	You don't really need to convince them of your logic. You can listen to them and go do your thing.
1	If you have to improve your Te (ISTPs' nemesis function) to relate to them. This is the only solution. If you can't, then don't bother with them. They live in a different world. 
1	My best advice if you are arguing on how to do something; is to just do it your way and if went succcesfully, show the results in their face.
23	Monotone	Are you monotone? If so, what if anything did you try to change? \n\nI mean yea I don’t get excited about much so I guess it comes through in my voice. 
16	Pretty monotone here. Didn't do much about it. Coworkers despise it though.
8	I'd say my  bf (ISTP) has a decently monotone voice MOST of the time. However his facial expressions are extremely monotone and hard to read (Not as much for me because I spend so much time with him but I get so lost sometimes lol).  I don't think he tries to change himself, he doesn't see the need.\n\n\nHe tells me stories about how frustrated people get or how they'll joke around with him about it haha. One of my friends (who has trained himself hard to read expressions)  met him and was so confused the whole time, my bf and I got a good laugh. (We were nice). 
5	I've been called monotone.  But who cares?  
5	My face is pretty monotone but not my voice. 
5	Ya and doesn’t help that I have resting bitch face \n\nAt least it reduces wrinkles :D
4	Monotone when I’m not interested in the topic. \n\nAnimated like a crazy wild-eyed mad scientist when I am, think Doc from Back to the Future. 
3	Uhh, no, well, I kinda had to work on the way I acted, with both facial and vocal expressions and don't think about it anymore. Theatre helped in HS. I just wish my eyebrow muscles could help me show a bit more sadness like cartoon characters...or like Jon hamm
3	Yes. Students didn't like when I would read to the class and that's the exact words they used.
2	Yeah, My Facial Expression and Voice are super monotone which clearly annoys people that I’m taking to because they can’t read me.
2	I used to be more monotone. Didn’t do anything on purpose, just kind of picked up characteristics here and there. Listening to podcasts drastically changed the cadence and tone of my speech. Interacting with animated people, too. 
2	My default is monotone but I’ve developed a range of emotional expressions through practice. Honestly, doing theatre in high school and then being an NCO in the Army were two things that really made me more outwardly expressive.\n\nSo pretty much get into something where the impact of your expression is the tool you need for your task and you will learn.
2	I used to have this problem, along with not enunciating words and resting bitch face. I wouldn't care except for people wondering if I'm okay or why I'm pissed
2	I've learned to replicate other people emotions, tone, expressions, etc in most situations. Unless you know me when you'd never know I'm attempting to be human with you. If it's a situation I've yet to master then I become your typical istp, initiate robot and disappear the moment you blink.
1	These answers are so interesting, because my ISTP (confirmed) friend is very expressive and excitable. He loves to explain things to me, especially how he became really good at okcupid in his dating days, lol. another suspected ISTP friend of mine was pretty expressive too, especially when he was very excited about showing me the tiny house that he built. I guess there are variations in ISTP...Alex Honnold seems like the classic monotone ISTP (if he is one). 
1	I'm not, plus I'm p much happy all day long and on social interactions I like to change the way I mention things as much as possible
1	I am sometimes but its only when i dont givea fuck
1	My fiance always tells me I'm like a robot. Then he makes fun of me by making robot noises. Be-boop-boop. \n\nI get really excited about some topics though. (Like whatever my hobby is for the month). I'm pretty certain the excitement comes through in my voice when I talk about those things.
1	Apparently I can sound very apathetic even when I'm not. According to my one sister I'm more monotone than a lot of people but I'm less monotone than my INTJ sister.
6	How often do you go get lit at the club?	
22	Never. Waste of time. 
9	Never. After about 30 minutes it stresses me out and i just wanna go home. Way too much energy for me. 
5	Never. I get lit over video calls in the middle of the night with my friends
5	Club? Never. But I’ll get lit at a rave/festival/concert. \n\n\nClubs aren’t about the music. They’re about getting fucked up and grinding on some greasy stranger. I don’t go to shows for the people, I go for the music. And being lit makes the music more fun. 
5	The thought of a loud crowded night club makes me shudder at this point in my life lol (31)\n\nI used to visit them in my early 20’s every week or two and would get just absolutely shitfaced every time I went. Took me a while to realize I was drinking heavily to compensate for my anxiety from being in a noisy crowded club. I didn’t like the atmosphere but couldn’t admit it to myself because I didn’t wanna miss out or seem uncool. \n\nNow, every once in a while I’ll go play pool at a dive bar or something. MAYBE even karaoke if Im feeling social and crazy that night. But a dance club will forever remain a big nope 
3	Sometimes, and usually with MDMA...
3	"The club"? Never, I will never go to a club.\n\nThe bar? Not so much anymore. Used to go every Friday and stay until they closed. When they banned smoking, a lot of the people I played pool with didn't come back.\n\nBig concerts, yes. Though within reason; I've missed a few by being too messed up too early.
2	In my early 20s quite a lot. Now almost never.
1	Literally never.
1	N e v e r
1	I used to go out (almost) every week. Got lit beforehand cause we were all broke and messed around till 4. Nowadays I don't have friends so I just get hyped on music on my own till 4 in the morning in bed.
1	2019: 0 times\n\n2018: 0 times\n\n2017: twice.\n\n2016: once. \n\n2015: maybe 4?\n\nI can’t really remember further back than that.\n\nIt’s just not something I’m interested in. I don’t mind sitting down having a pint and a chat, but I can’t be doing with loud music that I hate and drunk people that I also hate. 
1	I prefer festivals and punk/metal/edm shows. The club is not my domain.   \n\n\nMDMA helps, though. 
1	Every week son, fun as fuck, good chance to engage Fe, good music, alcohol makes you stop overthinking
1	Club or Bars, Never they are the worst. \n\nAt the frat house raging with my brothers, that is another story
4	Does anyone have any experience dating their type?	When it comes to platonic and intimate relationships, I see a lot of info on how *theoretically* healthy it is to step outside of your comfort zone and constantly be challenged in your ways; personal growth and all that. But if I'm being totally honest, I've been in a LOT of relationships for someone my age and, looking back, I'm almost positive that none of them were with an ISTP. I also can't help but be intrigued when I read descriptions of other ISTP women and how they act, dress, and see the world. I find myself wanting to know more ISTP's. I get that it would be totally unhealthy to to bury myself in a world that never differs from my internal one, but just indulge me for a bit:\n\nDoes anyone have any experience dating their type? How did it go? What were the strengths and weaknesses of the relationship? What was ultimately your undoing? Would you do it again, knowing what you know now?\n\nThank you!!
3	One of my best friends from uni is a walking stereotype of ISTP. I don't know enough about functional stacks to say definitively that he is or isn't. But I assume he is.\n\nWhen the two of us are hanging out together without our SOs we just keep ramping up like the PENIS game in human form. Neither of us can say no, neither of us wants to stop.\n\nHim: Want to take a shot?\n\nMe: Yes! Wanna Sing Karaoke?!\n\nHim: YES! WANNA SET SOMETHING ON FIRE?!\n\nMe: **YES!!! BUT FIRST LETS HAVE ANOTHER SHOT!!!!**\n\nI'd imagine if we actually dated each other we would both burn out very quickly (pun totally intended). \n\nMy H is ISTJ and I think it's just the right difference of similar enough to not get on each other's nerves but different enough to keep each other on our toes. As long as I am able to keep my P-life together well enough he doesn't feel the need to push his J on me and as long as he doesn't force his J on to me I don't feel the need to run back to P in rebellion.
2	I could never date someone like me, way too infuriating
1	Dear god no, I don't need another me. Give me an Intj or an Entp any day 
3	What is your mbti and love style?	
5	quality time/physical touch, i don't like giving or getting the other ones much
6	love is for losers and weak people who cannot be alone
2	Istp, acts of service, physical touch 
1	Quality time mostly. Not sure about the other ones.
13	What style do you have guys?	It is just interesting what kind of clothing style ISTPs have.
27	zip up hoodie and jeans all day everyday, at home change jeans to sweatpants.
13	Just about every thing I wear is black and grey and must be comfortable. I  guess I don't like to stand out. I like to do my eye makeup but never any type of bright colors and skip colored lip stick. 
11	Guess ISTP's dress what they are comfortable not fashion (minimalists we are).
8	21 m istp. Im like torn half and half between wanting to wear the typical Van's, ripped jeans,  graphic t, bracelet and a logo hoodie, or like the most out- there style ever.  I'm talking tank top and samurai pants or even like flip flops, jeans, and a floral shirts.
6	Something comfortable and sporty
5	I *might* be an N (I've been looking more deeply into the function stacks but still not 100% sure)\n\nBut anyway I'm a skinny/average 23f and I have an *almost* tomboy style. Picture: skinny or fitted jeans, casual sneakers, ribbed tank, flannel or graphic top, a choker, and beanie with full-face makeup (but not overdone). That's my style like 90% of the time. The other 10% is a mix of "I'm going to my stereotypical middle-class parent's house today" and summer boho-chic in...well, the summer.\n\nEdit: oh right and pullover hoodies lol
5	Comfort over everything! I could never sacrifice feeling comfortable with looking stylish. Love sweatshirts/hoodies combined with yoga pants/comfortable pair of black jeans. Black, cobalt blue, yellow are my fav colours to wear as tops! Though most of my closet is monochrome, I don't mind some colour
4	Used to be plain, minimal logos, jeans. Now I rock Pikachu and Stitch in each other's pajamas, a pixelated Sonic and still kind of plain-ish. Nothing crazy, except sometimes the Santa shirt n belt my family got me for Christmas around the holidays.
5	My style is all over the place. I like feeling good in my clothes, but also looking at least a bit unusual. When I'm lazy I will usually wear a crop top with jeans and an oversized hoodie or a huge sweater with shorts and thigh highs, sometimes with makeup, sometimes without. Then there are days when I want to have a "look" so I go for more non-ordinary combinations and do some colorful makeup. Those times I like to match jewerly and my septum piercing to my outfit.\n\nAlso, I consider my hair a part of my style, used to have long neon yellow, but then I shaved it all off and now I dye it any color I want while waiting for it to grow.\n\nBasically I wear what I want and do what I want with my appearance, don't care about current fashion trends and stuff.
3	I wear colorful shirts, or black ones, I wear hoodies, I wear sweatpants, rarely jeans, and skater shoes
3	All depends on the occasion. \n\nMy day to day: jeans that make my butt look good, are comfortable around the legs with a t-shirt, flannel, or 3 quarter sleeve that is _just_ tight fitting enough with my steel toe work boots. \n\nAverage Going out: jeans that make my butt look good, but are actually very nice (designer) and have a tighter cut. A slim fit button up, top three buttons undone, maybe sleeves rolled up, shoes depend on weather, but anywhere from leather boots to suede sneakers. Goofy/fun socks. \n\nDressing up: pair of tailored slacks that make my butt look good, leather dress shoes (brown or black depends on the shirt/pant color combo). Slim fit button up with a smoking jacket. Goofy/fun socks. \n\nHome: sweat pants that make my butt. Nothing else. \n\nEdit: everything I own is comfortable. When it comes to being stylish, I will spend the extra money to have fewer clothes that are more comfortable. I will also never shun away from a 10 year old t shirt that is perfectly warm in. 
2	black jeans or leggings, hoodies or simple oversided sweaters and pumas or vans, rarely some mascara, it just needs to be comfy
2	I live in the tropics so I make sure I'm wearing comfortable and good quality fabric. Linen and cotton. I dress up when the occasion calls for it, but I go for t shirt and jeans all the time. and leather sandals. 
2	When it's not my day to day basic fits (usually a sweatshirt or hoodie for a top, black jeans or navy chinos for bottoms, and white Van's for bottoms), I love experimenting with my style. \n\nCan go from a pink sweatshirt to match with my [pink Golf Le Fleur shoes](https://stockx.imgix.net/Converse-One-Star-Ox-Tyler-The-Creator-Golf-Le-Fleur-Geranium-Pink.jpg?fit=fill&bg=FFFFFF&w=700&h=500&auto=format,compress&q=90&dpr=2&trim=color&updated_at=1538080256), or a creme cardigan with oversized brown pants and brown shoes. Or if I want to freak people out at my school a bit, I'll wear my techwear outfit.\n\nMy biggest thing about my style is my standoutish-ness though. For example, my campus hosts a day called "Day Without Hate" and I'm wearing [this on that day.](https://cdn11.bigcommerce.com/s-stm8v/images/stencil/500x659/products/1434/3617/NO_VIOLENCE_VEST_1__89276.1550325391.png?c=2&imbypass=on) I've always worn stuff that scares or confuses people. 
2	I wear cargo pants, a t-shirt, and combat boots every day. If the cargo pants are tan i wear a light colored or red shirt, if dark anything but light colored shirts. 
2	Vintage clothes I find that the thrift store or just steal things from my grandmother's closet. 
2	I would like to wear jeans and metal t-shirts everyday like I used to, but being an adult means I usually wear button down shirts and slacks. But I do wear New Balance sneakers. 
2	17M-Black skinny jeans, Hawaiian styled/trendy t-shirt, a huge faced minimalist watch, skater shoes
2	25F, I'm very unstylish for my gender.\nPlain everything, no graphic tees, some horizontally striped ones. Mostly black, grey and blue. Red or yellow if I'm feeling fancy that day.\nHot weather: t-shirt, short pants with pockets.\nCold: t-shirt, hoodie, jeans.\nI usually wear running shoes or vans.\nNo make-up, kinda short wavy hair with volume that I style with my fingers.\nI've thinking of adding some shirt to my wardrobe and a pair of less-sporty shoes.\nYep, I'm a minimalist.
2	Male,20,skinny frame.  \nWhen I want to look good/going out : Skinny black jeans,black doc martens,white t shirt,leather perfecto jacket.  \nWhen I'm chilling or just not doing much: skinny black jeans,black hoodie,reversed snapback, black nike high tops. Hood is always up,even over the hat!   \n
2	26F - Minimalistic/Small wardrobe \n\nCombat boots, black skinny jeans, tight black top, black leather jacket. \n\nSometimes I add stuff or remove things to change up the look. (Like a flannel tied around my waist).\n\nI wish I could just always wear the same thing *everyday* and not have to worry about this.
2	Dark and minimalistic. Black jeans, black boots, black sweater, and dark green coat is my go-to winter outfit. 
1	tshirt, shorts, teva sandals
1	Depends on my mood. For the winter it's been fleece leggings, boots and a sweater. If it was spring I'd just wear pants. Don't want to deal with pants tbh.
1	I usually wear jeans or demin shorts with a sweater or t-shirt. I have plain and graphic shirts but I wear the plain ones a lot more. When I feel more fancy I have these boxy button down linen shirts I really like and 60's inspired blouses with bows or bell sleeves. Shoes wise I usually switch from combat boots to flip flops in the summer. 
1	Fashion is one of my main hobbies, but even though I have a beautiful wardrobe I love very much, I find myself wearing comfy jeans and a grey hoodie most days
1	Jeans, hoodie.
1	Whatever Vans has on sale. 
1	Jeans and a T, even to work. \n\nSometimes I change it up and wear sweatpants
1	24, male, teacher. Cossack haircut, well fitting plain t-shirt and jeans/chinoes, sports watch, awesome shoes, usually variants of allstars, then leather jacket or my awesome varsity jacket. Id say my jacket and shoe game is pretty much on point. At home I always change to fairly tight sweatpants :)
1	My style is more conservative/classic.  I work at a somewhat high end store and get a pretty good employee discount.  So my usual outfit consists of some pants, a button up shirt, a sweater or waistcoat, and boots.  My tastes are more masculine, but on days when I feel more feminine, I'll go with a nice dress with flats and a cardigan or jacket.  \n\nAnd most of my things are either blue, green, or a mix of the two.
1	Edgy Classic, mostly black with some dark green, grey, red.
1	To school or work : Jeans and a basic shirt or sweater\n\nTo hangouts or other stuff : Dresses\n\nColors : Dark Green, Blue, Bordeaux, Black and Floral
1	I'm obsessed with 90s punk (senior in hs)\n\nBaggy jeans/pants, shirt if some sort, leather jacket or windbreaker\n\nGrease my hair back
1	I have 5 of the same black long sleeved shirt and jeans. I usually wear that with a pair of black boots and hoop earrings to work. My hair is long and a bit curly, and I leave it down. Make up is a tiny bit of eyeliner. Maybe a tinted moisturizer. All of 1 minute to go from pajamas to out of the house. At home I wear hoodies and jeans. I went through an all black phase a while back, but decided to tone it down recently by adding dark blue jeans into that mix :P 
10	Teach an Fi user to give no fucks like y'all	Please help. ISTPs seem to do what they want and have no qualms with people being offended in common interaction. Some people might be turned off by that, but I personally admire it a lot. I believe this is a function of Ti being in the dominant position for you all but I'd like to hear other your explanations on how this works for you.  
24	I am actually VERY insecure about how others feel, but only ever after the fact. And if I still believe I'm right (which I often do) I'm not going to say I was wrong just to make things better. I kinda hate it and I'm glad I'm an introvert because relationships (intimate and platonic) can get very tough to maintain when your mind works that way. People want to be right, or they at least want to know that you don't mind being wrong. I don't mind being wrong. I really don't. But I don't come across that way, and saying so doesn't really mean anything when you're still holding your ground. 
16	The only way I can explain it how I learned the term "self actualized" in psych classes. It's hard to explain, it's more of a feeling that I learned and embraced as I got older.\n\nIf I had to explain it, it's something like: I'm happy with the me I am, I owe who I am only to me, I worked hard to get here, so I'm my own top priority. My happiness is more important than people who would seek to minimize my happiness (for many various reasons). My values are important to me, and I generally admire those who espouse the same values and have zero fucks to give about people who act contrary to those values.\n\nI don't think it's a matter of not caring if I offend people. Since I live by my own personal code, it's important to me to respect other peoples' personal codes, so I try hard to understand and not overstep. But at the same time, to me, my code still trumps if there's something that runs afoul of mine, I'm back in "dgaf" mode.\n\nI don't know if that comes off well articulated or not. It's kind of hard to explain why you don't care about something because "not caring" is in itself, a lack of any sort of explanation. \n\nIf I had to overgeneralize with platitudes, it would go something like: you're the best you, be the best you, and if anybody tries to change that, they don't deserve any emotional investment on your part.
5	i honestly feel waves of gratitude nearly every day that i am not a feeler, so i sympathize with you. i am virtually unaffected by what those around me think and i’m pretty happy and content all the time. though there are great things feelers do for the people around them, it seems like you all mostly just suffer personally for it. both my sisters are INFJs, and i see this every dang day. your overall experience with anxiety also depends on how active your cingulate gyrus is, which is not something under an individuals control (as far as science knows so far). \n\nTL;DR: i cannot help you, i’m sorry <3
5	I don't care about certain things like I love to get into political debates or do things like talk about **things** that others shy away from or makes people angry.\n\nI guess it seems trivial to me that some things are taboo so I just don't care about it being a rule. But when it comes to asking someone something personal about themselves or their feeling or expressing certain feelings of my own sure I can get very nervous.
3	Vodka helps.
3	I strive to be honorable, I don’t always succeed. And I don’t mean “honorable when people are looking” or “ignore a person in need if I have plausible deniability.” or “only be honorable if you know the favor will be retuned in kind”\n\nSince I approach life in that manner it is much easier to think: I don’t give a shit about what you think of me. What I think of you is all that matters to me.
2	It's a process for me.\n\nStep 1: Do I know about this thing/person/ (or anything)?\n\nStep 2: If yes, do I have something new to add/say?\n\nStep 3: If yes, how will I say it in a way that it's going to be received as something helpful?\n\n&#x200B;\n\nIf answer to Step 1 question is No, I prefer to shut my mouth. People say it's IDGAF attitude. But really I'm just being honest to myself that I have no purposeful opinion to add. Or refraining from being /imsoverysmart\n\n&#x200B;\n\n&#x200B;
1	What type are you?
6	Sleep schedules?	Changing my sleep schedule may prove beneficial. Has anyone ever tried segmented sleep?  What sleep pattern do you have?
