371	Your ISTP Care And Handling User Guide And Manual	##**Your ISTP Care And Handling User Guide And Manual**\n*****\n\n**Congratulations! You have found yourself in possession of your own unique ISTP unit. Or rather, it has found its current situation agreeable for the time being. Since ISTPs are notoriously difficult to understand, we have issued this guide to help you along the way.**\n\n###**Getting Started**\n*****\nYour ISTP unit should arrive pre-activated and ready to solve problems. In case your ISTP has not been activated please complete the following:\n\n1. Place ISTP in a quiet setting.\n\n2. Point out 1-3 problems or things you do not understand. \n\n3. Wait 30 seconds.\n\n4. If after 30 seconds your ISTP unit has not activated, asking your ISTP to “Open up more emotionally” will immediately activate Flight Mode (though this is not recommended).\n \n\n###**Care and Maintenance:**\n*****\n1. Your ISTP unit does not require any direct care, supervision or maintenance, and will be happiest left to its own devices. \n2. Efforts to assist your ISTP will be met with annoyance and could possibly void your warranty.\n3. If you give your ISTP rules to follow, you should take care to explain why they are in place. You should also expect that if they are inane rules, they will not be followed.\n\n###**Interpreting Your ISTP**\n*****\nAt some point you may say to yourself, “I wonder what my ISTP is thinking?” Here is a short guide on how to interpret your unit’s words and actions.\n\n>**[Silence]**\n\nYour unit is likely thinking through a problem, contemplating its surroundings, or is thinking about nothing at all. Do not worry, this is normal.\n\n>**“I’m fine.”**\n\nYour unit is fine. Do not worry, this is normal.\n\n>**“I need some time alone.”**\n\nGive your unit time to recharge. If you recently subjected your ISTP to an intense or prolonged period of social interaction, this should be expected. However, frequent abuse of your ISTP’s limited social engagement function is not recommended and can void the warranty.\n\n>**[Shared experience]**\n\nThis is as close to your ISTP as you will likely get. Willingly participating in an activity together is one of your ISTP’s primary methods of communicating fondness.\n\n###**Software**\n*****\nYour ISTP comes pre-programmed with the following abilities/traits:\n\n+ Remains calm in urgent and stressful situations.\n\n+ Reliably grounded, realistic, and pragmatic.\n\n+ Ability to be a “Fly on the wall”\n\n+ +10 Tinkering Skills\n\n+ +10 Logic\n\n+ +10 Feelings Resistance\n\n \n\n###**Frequently Asked Questions**\n\n>*Does my ISTP actually like me? It’s getting hard to tell and it won’t respond when I try talking to it.*\n\nProbably, especially if your unit willingly chooses to spend time around you. Try not to talk so much.\n\n>*Help! I think my ISTP is broken!*\n\nYour ISTP is not broken. Due to its natural ability to overanalyze and rationalize (sometimes to an unhealthy degree), your unit may be stuck in its “WTF Years”. Give it time to grow, and offer encouragement when needed.\n\n>*Can I keep it?*\n\nUnfortunately that depends on the model. If your ISTP goes missing for an extended period of time it is possible that you have accidentally activated your ISTP’s aversion to commitment. However, with some models this feature has been omitted, in which case you might be able to keep your unit for the entirety of its expected lifespan.\n\n**Congratulations on your new ISTP unit and we wish you many years of interesting experiences!**\n\n*****\n*****\n(This post was heavily inspired by [this](http://thoughtcatalog.com/sarah-brady-wagner/2016/05/your-enfp-care-and-handling-user-guide-and-manual/) guide to ENFPs. I thought it was amusing, but a little too long. Mine is shorter and obviously specific to ISTPs. Hope you enjoyed it!)
99	Beautiful. Can we sticky this and just refer relationship threads here?
33	This here is a high quality post! Humorously written with a lot of actual good advice. Mark this ISTP approved!
20	Okay. Time to shut down any and all MBTI related threads. This one is the hands down winner!
13	this should be given to out to our SOs -_-
13	Well played! Commended.
11	Thank you for this! From an INFJ who thinks her ISTP is not really fine when he says "I'm fine". 
11	I want to send this to my co-workers.
11	Oh, ok. That would have been nice to know before I broke mine. 
11	this is fantastic
9	I found this excellent enough to say that it is excellent. 
10	Give the ISTP tools, but be wary as a juvenile ISTP unit may disassemble devices (like a tv remote) and not know how to reassemble.
7	hehe.  I really liked this.  good job.
6	(tear forming). you get me.
6	Late to the party ofc but jesus this is the most helpful shit i've ever read to understanding this girl lol. INFP here but so glad to see that it's not that she doesnt like me (or maybe it is) it's just how she shows fondness. *mind blown* now i know to stfu and enjoy this shit
6	Phenomenal
5	lmao love this
5	Fucking A man, thanks for the laugh.
2	Spot on
4	I laughed at every characteristic you laid out.  It's like you know me better than I do.
4	I laffed\n\nwhy can't our sticky be this funny? :(
4	INFJ here who has spent most of the last decade in a whirlwind relationship with an ISTP. You NAILED it. Sometimes it's easy to forget some of these things about him. Awareness of these behaviors/tendencies & a solid understanding of their innateness is key to keeping your ISTP long-term. 
3	Thanks for the read, quite enjoyed it. 
3	Bravo!
3	Yes! this is too accurate. Great work.
3	So true!
3	This made my day as an ISTP. Best thing I've read all week :)
3	this is hilariously on point! love it!!
3	How long is an extended period of time?
3	Wish I had seen this sooner. If my ex had it maybe we'd still be in a relationship. \n\nI may just print some of these out to give to new people I meet. 
3	This would have saved me SO much grief over the past 2 years.
2	By far the greatest post I have ever seen on this sub 
2	I really enjoyed this, thank you.
2	Really wish I had access to this guide several years ago! I took my ISTP apart trying to 'figure the unit out'. I don't think it ever got put back together quite right. Whoops...
1	Damn... I wish there was one of these for /r/ISTJ
-3	Still too long
-4	Yo, can we get stuff like this for some of the other, superior MBTI types?
11	Best/ Quickest way to Shattered your heart	Whether it be a friendship or romantic what it the best/quickest way to shatter your heart\n.\n(For romantic exclude "I've been cheating on you") 
20	Reveal to me somehow that they've judged me incorrectly and have made negatively impactful decisions about our relationship based on these incorrect assumptions about my character. \n\n  As a close friend or SO, them not giving me the benefit of the doubt in the situation is just not something I can easily move on from. If situations were reversed, I would feel like assuming the worst in them would be like a betrayal of trust in them as a person and in the way I think of them.
9	Being ignored, or acting excited around other people but not me, I hate that shit
8	Tell me there's absolutely no purpose to something I've been busting my ass on for an extended period of time, or that I personally haven't accomplished anything. Wanna see me in a full-on depressive slump? That's how ya do it 
7	"Shatter my heart" would be too dramatic. The closest thing to heart shattering was at my wedding when my bridesmaids, my closest friends since high school, showed up late and spent forever getting ready in the dressing room while I was greeting incoming guests. I went upstairs once and texted them twice to come down as soon as they were ready. Any one of them would do. They all came to the wedding hall together when the ceremony was about to start and there was literally nothing left to do. Fortunately, my colleagues jumped in when I was running around like crazy ushering the guests to their seats. I've never been so grateful.\n\nI spent 1-2 days after my wedding asking a few friends around about what happened in that dressing room. I tried to convince myself that they were trying their best to be quick despite arriving so late but every single thing I found pointed the other way. When I accepted it, something inside of me died then. I spent hours crying and then felt nothing towards them at all. No anger, no hatred, no sadness. Nothing. Like you don't give a second thought about strangers you pass on the street and you simply don't care what they do with their lives because it has nothing to do with you. That kind of feeling. \n\nSorry for a long post. I guess my answer is betrayal of trust. As an ISTP, I like doing things myself and I rarely ask people to do stuff for me. When I do ask, it means a lot to me and if you say yes, please keep your word. Or do it the other way round if that's what you aim for. 
7	I never understand when people use 'heart' like that(follow your heard, heart break etc) . I dont have that feeling. 
2	I'm pretty stable, and I doubt there's some magic key to "shatter \[my\] heart." However, if you want to piss me off, calling me an idiot is a great formula. 
2	Oh, I just *hate* it when my friends cheat on me. Lol. \n\nProbably by dying?  That usually does the trick...
1	Betrayal of trust, or, if you're someone whose opinion I value highly, lead me on and let me think I'm really good at something, encourage the thought that I'm good at it, and then later on tell me that you think I suck at it and you only let me believe that I didnt. Super stupid backstory, I was sick a fair amount as a kid (think under 12 years old) so I was in the ER off and on. To help pass the time my mom and I would ALWAYS play I Spy. I would go out of my way to find the tiniest, most annoying speck of dirt or paint on the wall, or the tiniest feature in the room, and make that what she had to find, and she usually lost, and would give up in frustration. A little over 10 years later she tells me, after I suggested we play during one of her appointments, that she was only letting me win and that I really wasn't that good at it. That one stung quite a bit. Please don't do that to people, lol.
4	What are cute things your SO does for you? Cute things you would like them to do for you but don't?	If you're single, imagine being in a relationship with someone, then think about these (lol).
4	I like the little thoughtful things, things that would go unnoticed by anyone else but make it seem like the Universe is trying to hint that it cares about you.\n\nLike you open the fridge, thinking “Shit, I wish I’d gotten some-” and there that something is, as if by magic. And you know the magic came from someone thinking about you.\n\nOr when you are the one spinning magic and your SO notices the Universe trying to hint it cares about them. I love that.
7	Do you guys have a difficult time analyzing a person sometimes especially if your talking or dating them and there’s problems ?	
12	Do you guys think using Fe ever gets in the way of you focusing on a task or using Ti Se ?	
11	In what sense? A day to day Fe or an Fe build up due to something you’re avoiding?\n\nA day to day example:\nI am a metallurgist (process, product, and quality engineer) for nickel superalloys. When something goes wrong, that’s 10s of thousands of dollars lost on a good day... 100s on a bad.  When I do my investigations, I find information that could get someone fired. Someone I know, someone I may talk to every day...\n\nDoes not stop me from doing my analysis. Now it may influence on how I handle the corrective action. I don’t fire people if I don’t absolutely have to. I try to find a corrective action that will fix the situation. But, there is still some influence, as I’ve given people second chances that no one else would have in my hierarchy. \n\nAn event example:\nDoing same job. In the middle of data analysis. Recently found out my mom has a debilitating disease that will leave her more disabled the longer she lives with it. Tried to just focus on work. Found myself talking to myself and having to take deep breaths, and eventually just staring at a screen. \n\nSo only severe events will distract me. Typically because I am trying to think my way through the feelings and how to handle that situation, which detracts from my normal processing power. 
3	No I didn’t mean like that but thanks for your examples, I meant more like worrying about how i come off to people when communicating with them while working, and trying not to be to cold and it gets in the way of me being able to focus. Like that like in your field someone asking you saying something causal to you and you try to use Fe to respond like eye contact smile would it throw you off at all ?
3	I think I try to "use Fe" sometimes to sugarcoat what I'm saying so it doesn't upset people. But it fucks up what I was trying to say, so I stopped doing it as much.
4	I doubt you are ISTP if Fe gets in the way of Ti. If you were ISTP, you should theoretically have the opposite problem 
2	favorite movie or tv show?	i like that 70s show
1	Once upon a time in the west.
1	I really love burn notice, and GoT of course
1	Some of my favorite movies are Big Lebowski, Pulp Fiction, Star Wars, Office Space.
1	movie: star wars\n\ntv show: brooklyn nine nine
1	Blade runner
1	Currently watching the magicians and penny dreadful on netflix
1	Movie: perfume:story of a murderer, arrival, lotr, Alita:battle angel\n\nTV: GoT, Rome, Westworld\n\nAnime:FMA:Brotherhood, hunter x hunter, silent voice, paprika
17	Do you lie?	Is honesty a istp thing or just me? I find that I never really lie as I don't see a reason to. For example if something goes wrong and someone tries to blame me or put something on me. I know I followed exactly what I'm supposed to be doing correctly so I know I won't get in trouble for telling the truth. Another example when it comes to talking to people I won't lie about myself or about something that happened because it wouldn't satisfy me if I persuaded someone on a lie. Even in situations where I did do something wrong I won't lie because what's the point if I already did it? I would say yeah I did it and if there's consequences then oh well I'll get past them.
17	Outright lie? No reason to really. I will embellish a bit sometimes though.
18	I don't think I've ever been in a situation where I've felt lying is necessary. I've withheld the truth before (not telling someone about something that was meant to be a surprise) but for the most part I've never really seen the point in lying.
13	To dick around and be playful around people yeah. But otherwise, i’ve been known to be brutally honest.
5	Honestly, I lie SOMETIMES but it's usually only to serve some short term, non permanent goal. I can't think of a time I've lied about something relatively important. \n\n&#x200B;\n\nMeaning, I don't lie at work. I've lied at home though like,\n\n&#x200B;\n\n "Hay Jayb151, did you do the laundry yet?" \n\n&#x200B;\n\n"Ah yea babe, It's been done for hours." \**frantically folding laundry before wife comes home from work*\*\n\n&#x200B;\n\nBut yea, in reality, I find it too much work to lie. You find yourself living in some web of deception that will fold in on itself eventually.
4	Only to get out of things I don't really want to do without saying "I don't want to go". Instead it's "I have to help my dad" or I'll say I'm on-call for work.
3	I lied a lot to my parents growing up because they're close-minded and were very controlling... but now that they're out of my life, I no longer lie. I'm not ashamed of the things I do anymore 
3	For me at least, lying just seems like a waste of time. Why would I spend extra time and energy to make up a whole new story when I can just tell you the truth? 
2	Nope, i can avoid the truth if it is something that i shouldn't say, but if i get asked directly I will give a short and precise answer.\n\nAnd then die.
2	Not really lie so much as, not elaborate all the details. 
2	I think that anyone who says they don't lie is lying to you.  
2	I know stuff...you just have to ask the right questions to get it out.\n\nIf i don't feel like you should know about something, i'll just say that "i don't know...(if you should know about this)"
2	Deception is an ugly tool, only good to use on someone who is hostile. 
1	I was going to say "yes, all the time" but actually I agree with what you wrote. I only really lie for joking around (which is a lot), or if I have to (white lies etc) 
1	Of course, I doubt few if any in the world don't lie on occasion.\n\n Mostly I don't bother, but I'm not morally above it by any means. There are things I could lie about without hesitation, and things I'd never even consider lying about and look down on others for. Basically I don't feel guilty about lying, but I won't lie about something that would fuck anyone else over, or in a way designed to manipulate/deceive anyone into something. 
1	I do lie, but not unnecessarily. Only when I feel the consequence for not doing so will  be too severe, then I do. 
1	I lie alot if it's not hurting others
1	I lie as part of experiments, never to just cover my own ass. 
1	Ok.  Today I lied about not having time to see someone- where in fact I just didn't want to find that time to see him. He's a friend who's been wanting more of my time lately( due to his own reasons and having too much time on his hands- and have been having a hard time hearing no)- where I have no spoons left- and I've told him that- that I need to pull back and take care of my business. \nWhile technically it's not a lie- I don't have time im willing to allocate there-or emotional resources to provide companionship/ recreation- if there would be a serious, dire need- I'd find that time. \nAs it stands now- he'll have to find ways to amuse himself without me. And I didn't want to tell him that I don't want his company- not this often-he'd definitely feel hurt( where all im saying- that I don't have the mental energy to provide that for him now)\n\nSo.  I lie to spare people's feelings sometimes.  Maybe it's misguided. 
1	Not always I do on occasion to test my skill or for small things that won't impact anything. I'm also generally transparent but I without a strong relationship with anyone
0	[deleted]
7	do people think you look Mean?	Just had that experience today. A cashier just flat out asked me, 'Why do you always look mean?' and I was a little surprised. I try to be friendly and polite to people and being mean is my last intention. But my resting face just looks threatening apparently. Anyone else get that reaction?
10	I look like I don't give a shit.
7	Yup...I got the "do not fuck with me" face and attitude. I am also a woman with huge boobs and it confuses people... 
2	Yes. People sometimes ask me why I'm not smiling. I honestly feel great without being smiling all the time, but let's face it, this is not about ourselves but about making others feel more comfortable around you. It's a simple gesture that demands little effort and can radically improve our daily social interactions. At least I do notice that people tend to talk more to me and be more friendly if I'm packing a smile.\nFurthermore, it's scientifically proven that forcing a smile does actually influence your mood for the better.
2	My grandfather always tells me-- only me-- to smile, so I'd guess so. 
1	Yes! Someone help me fix my face!
1	yeah, i like it though. i don't really look mad but have a very neutral expression most of the time, nobody ever knows what i'm thinking/feeling unless i tell them or have a real emotional reaction. i can't force myself to smile so idk what else i would do anyway
1	Yeah, but it's good most times. Ppl don't necessarily bother me 
1	"Bored" "aloof" "devil may care" but not "mean"... except sometimes ppl have said "I thought you didn't like me before I knew you"
8	Is it hard for you guys to do hands on work while having a conversation with someone, without making mistakes ?	
17	Personally, no. Still, please don't come near me when I'm working.
5	Depends. New task or routine work? When I’m at work doing routine shit like oil changes and tire rotations, I have no problem talking to my girl on the phone while she’s on break at her work. That shit is muscle memory by now. But if I’m doing something that requires new effort to figure out, like doing electrical work or engine work, I need to concentrate without distractions. 
7	I can’t even hear you if I am focused, even just reading.  Cannot even reddit and TV at the same time.
4	Yes. I can't work and talk with you at the same time, unless it's some kind of mindless task. \n\n&#x200B;\n\nIf you try talking to me while I'm working, the work will get done, but the conversation is going to suck.
3	Counting, Measuring , Reading, Watching. Just don't come near with all ypur distractions.
3	Hands on for me is usually coding, so yes, very much so. But if I'm working on anything else, no. I end up focusing more on the task than the person, and I miss half the convo anyway. My brain does not respond to human speech very well.
2	I need to be left alone during calculations, like measuring for cabinets or figuring material costs. I can figure anything out, as long as I'm not being pestered or second-guessed.
2	Yep, I was working something at work when my manager started pestering me. For the life of me I couldent fix  what I was working on until he walked away, it was like my mind was just blank.
2	No, Im either completely zoned in or not at all.. Unless it's something stupid easy. I am excellent at blocking out everything around me when working. I once had this child banging a spoon up against a bowl right next to my ear and I didn't notice until someone yelled at the child. 
2	Yes, I often mix up words or trail off when I'm doing something that requires my hands/focus. For example, say I'm trying to tie a flourocarbon leader on to monofilament (a very hard knot to tie btw) I'm not going to able to say anything besides "yep" and "nah" until I'm done.
2	Lmao not sure if this is similar, but in Product design and Manufacturing class. Talking is fine while I'm drilling, sawing or chiseling. But I instantly screw up stuff if I'm measuring 
2	Yes, I'll catch myself at some point zoning out of either the work or the conversation. And I often have to tell people to shut up for a second so I can a thing I can't do while people are talking. \n\nIt's like I can either listen, talk or think. But only one at a time. It was pretty awesome during my depression/wtf years. I used it to get a break from my mind.
1	not really but i still prefer to focus on one or the other
8	How would a ISTP and an INTJs differ with their functions in how they analyze a situation or thing?	
22	My dad is INTJ. He goes from 1, 2, 3,....me as an ISTP goes 5, 32, 7,.... in terms of what order we do certain steps of a project in. He uses some kind of flowchart logic, and I don’t. We’re both medical responders and I’ve seen him delay for a few minutes at a car wreck while he thought out if he should order a helicopter. The decision takes two seconds to make! It drives me nuts. \n\nINTJs think like chess, several moves into the future, making all the decisions at once. I think more like a card game or something where I can’t see all the info- I make a decision based off what I know, and move forward and make the next one when necessary. That way I can take things as they come instead of making a grand plan and having it collapse when something unexpected happens like he does. 
2	I used to be an INTJ while in the military. \n\nRecently I had a discussion with one of my uncles about work, leadership styles etc. We got on the subject of types of leadership and personalities our time in the military and how civilians are way different than service members. One of my cousins decided to take the MB just cause which then peaked my interest so I took the MB because I was curious if I changed in my thought processes since I last took it (3 years previous). \n\nSurprisingly I changed to ISTP.   I tell you what I still fit many functions of the INTJ but it was pretty uncanny reading the characteristics of the ISTP. Obviously I'm not all facets of it but wow much closer to how I am now.\n\nThere is pretty strict protocol in the military and other service jobs that I think while in and used to answering questions and figuring out solutions definitely changes how you answer the questions.\n\n
27	What Were you like as a child?	I remember being very weird and annoying, and it took some time to grow out of it.\n\n\n\n I cant help feeling like i should have been more aware of my surroundings and situations growing up because kids today seem so much more advanced than i.\n\n\n\nMy dad was also an istp i think and he lrt me take things apart like old vcrs and stuff. I was also kind of a loner, but not by choice. My family moved states a couple times and i had two sisters who naturally wanted nothing to do with me growing up lol. \n\n\n\n\nI almost feel like i grew into istp because my fe was starved or something and my ti and se were stimulated.\n
12	I once got into a serious 2 hour long argument with my friend's dad who tried to claim that insects weren't animals, at age 10. Honestly. That should tell you everything it needs to about me.
8	Damn, same. Except, I wasn't a loner by choice, but as a child I used to get bullied by my classmates. 
6	Slightly weird and occasionally very annoying. May be due to the resting bitch face that I had, or the brain-to-mouth filter that I did not have. These days I talk less and smile more… I like having friends and not getting into trouble, lol.  
